[
  {
    "candidateId":"R007-C001",
    "signal":"Multiple operating modules require the same ingestion, normalization, reconciliation, alerting, and approval capabilities.",
    "evidence":["Run 006 subscription operations already uses multi-source evidence, deterministic reconciliation, owner alerts, and governed execution.","Proposed inbox, bills, follow-up, documents, security, and warranty modules repeat the same control pattern."],
    "whyItMatters":"Building each module independently would duplicate infrastructure and increase maintenance and policy drift.",
    "affectedSystems":["Run 006","Future personal operations modules","Agent Factory"],
    "frequency":"CONTINUOUS",
    "impact":"HIGH",
    "proposedCapability":"Shared Personal & Business Operations Core: source registry, evidence envelope, reconciliation engine, exception queue, notification service, authority gateway, audit log.",
    "existingCapabilityCheck":"EXTEND",
    "priority":1,
    "confidence":"HIGH",
    "recommendedNextAction":"Architect the shared core before building the seven proposed modules separately.",
    "status":"NEW",
    "authorityRequired":"PLAN",
    "duplicateOf":null
  },
  {
    "candidateId":"R007-C002",
    "signal":"Owner repeatedly depends on remembering pending replies, future actions, approvals, and deferred tasks across projects.",
    "evidence":["Subscription Operations contains deferred G6 actions and later account additions.","Multiple projects use Resume Here and manual reminders to preserve continuity."],
    "whyItMatters":"Untracked waiting states create silent stalls and cognitive load.",
    "affectedSystems":["Projects","Email","Calendar","Notion","Agent Factory"],
    "frequency":"RECURRING",
    "impact":"HIGH",
    "proposedCapability":"Waiting-On & Follow-Up Manager integrated with the shared exception queue.",
    "existingCapabilityCheck":"NEW",
    "priority":2,
    "confidence":"HIGH",
    "recommendedNextAction":"Include as an early module after shared infrastructure.",
    "status":"NEW",
    "authorityRequired":"PLAN",
    "duplicateOf":null
  },
  {
    "candidateId":"R007-C003",
    "signal":"Important decisions, deadlines, renewals, and obligations originate across multiple inboxes and systems rather than one master source.",
    "evidence":["Run 006 revealed multiple email accounts and incomplete subscription coverage."],
    "whyItMatters":"A general obligation extractor can prevent missed deadlines beyond subscriptions.",
    "affectedSystems":["Email","Calendar","Notion","Documents"],
    "frequency":"CONTINUOUS",
    "impact":"HIGH",
    "proposedCapability":"Inbox & Obligation Manager using multi-account source coverage registry.",
    "existingCapabilityCheck":"EXTEND",
    "priority":2,
    "confidence":"HIGH",
    "recommendedNextAction":"Reuse Run 006 multi-source discovery patterns rather than building a separate mail ingestion stack.",
    "status":"NEW",
    "authorityRequired":"PLAN",
    "duplicateOf":null
  },
  {
    "candidateId":"R007-C004",
    "signal":"Notification logic is appearing in multiple systems.",
    "evidence":["Run 006 now defines ChatGPT owner notifications and governed SMS urgent alerts."],
    "whyItMatters":"Independent alert implementations will produce inconsistent severity, duplicate notifications, and higher cost.",
    "affectedSystems":["Run 006","Future monitoring teams","ChatGPT","SMS"],
    "frequency":"CONTINUOUS",
    "impact":"HIGH",
    "proposedCapability":"Global Notification & Escalation Service with severity, dedupe, cooldown, channel routing, cost caps, and owner preferences.",
    "existingCapabilityCheck":"EXTEND",
    "priority":1,
    "confidence":"HIGH",
    "recommendedNextAction":"Extract the Run 006 alert-policy pattern into reusable infrastructure after G6 validation.",
    "status":"NEW",
    "authorityRequired":"PLAN",
    "duplicateOf":null
  }
]
